[
  {
    "type": "gts.x.core.iam.settings.v1~x.core.iam.security_policy.v1~x.core.iam.password_policy.v1~",
    "tenantId": "4a9e8e2d-3c08-4df1-98b3-1e5e2d1b7b5a",
    "category": "gts.x.core.iam.settings_category.v1~x.core.iam.password_policy.v1",
    "properties": {
      "minLength": 12,
      "requireUppercase": true,
      "requireDigit": true,
      "requireSpecial": true,
      "maxAgeDays": 90,
      "enforcementMode": "enforce"
    },
    "description": "Password complexity and rotation policy.",
    "updatedAt": "2026-03-15T10:22:47Z",
    "updatedBy": "d47f3c9a-12ab-4e8f-b567-890123456789"
  }
]